{
  "schemaVersion": "1.0.0",
  "id": "evidence-static-sample",
  "type": "static-validation",
  "scenario": "standalone-standard",
  "targetCommitSha": "abe337894f93de3ddda525ea44898b33e1484070",
  "recordedAt": "2026-08-21T18:39:46Z",
  "result": "succeeded",
  "workflowUrl": "https://github.com/Azure/terraform-azurerm-avm-ptn-aiml-landing-zone/actions/runs/1",
  "capabilityIds": ["sample-capability"],
  "review": {
    "status": "pending"
  }
}
